2010-06-27 00:37:56,40.667371,-74.235455,I believe there is some mandate requiring me to alert you that I have unlocked the Overshare badge on FourSquare. http://twitpic.com/20c4hz
2010-06-27 17:30:07,40.661873,-74.212123,@lilninja96 It would be cheaper! Also, use complete sentences!!!
2010-06-28 16:46:30,40.667437,-74.235507,They're testing out the new Cornhole set.  http://twitpic.com/20sqgg
2010-06-28 18:12:30,40.667425,-74.235545,Why is Bowser so Captain Insano at the the end of New Super Mario Bros Wii?!?
2010-06-30 14:52:14,40.667328,-74.235300,Eating lunch outside. Only the sound of the wind and birds chirping. Good stuff. (@ Casa de Hartz) http://4sq.com/aQhKUv
2010-06-30 15:10:08,40.667437,-74.235486,@TheSciFiChick You won't lose any apps. Some just won't work with multitasking until they update them.
2010-06-30 16:12:05,40.667319,-74.235438,@TheSciFiChick Maybe that's just them... Everything I had installed still works.
2010-06-30 16:16:30,40.667319,-74.235438,@pASHionateLEY Farmer's tans are great!
2010-06-30 20:50:31,40.667371,-74.235456,Totally just woke up from an unexpected nap.   I think I may go see a movie.
2010-07-01 12:44:53,40.652426,-74.223482,I kinda wish Cable had an a la carte menu where I could get all my local channels and perhaps 10 selectable channels for $50 or something.
2010-07-01 13:29:18,40.651052,-74.221828,@Shaunbass I totally would show up to hear that sweet, sweet music to come, but alas I shall be in the City.
2010-07-01 13:30:52,40.651052,-74.221828,@milagrosfarias I started cleaning my room 3 days ago but got tired and took a break. Maybe I'll finish it today.   But probably not.
2010-07-01 13:33:20,40.651052,-74.221828,Amazing how many people outside 7-Eleven just need a few $ for a train ticket. That place must be the nexus of some transportation vortex.
2010-07-01 16:51:29,40.741650,-73.993689,Some dude just legit skipped across 22nd St.
2010-07-01 16:57:20,40.739334,-73.993802,Picking up a camera lens for Independence Day. (@ Adorama w/ 4 others) http://4sq.com/4AhXIk
2010-07-01 18:08:22,40.774571,-73.982235,Behold its glory.  http://twitpic.com/21legw
2010-07-01 18:09:25,40.774571,-73.982235,@davidjtate I just saw an iPhone 4 for the first time today. Now I want one.
2010-07-01 19:05:36,40.772493,-73.974036,Reading in Central Park.  http://twitpic.com/21lsow
2010-07-01 21:40:30,40.749964,-73.993282,On a swanky new double-decker NJ Transit train! http://twitpic.com/21mxto
2010-07-02 01:05:33,40.662182,-74.212384,Gotta put some more images up on the Jumbotron! (@ The Liberty Center) http://4sq.com/d40vVM
2010-07-02 17:55:48,40.661841,-74.212041,Seems like every Uruguayan in the city is on Elizabeth Ave, honking horns and waving flags. Something must have happened in the world cup.
2010-07-03 01:00:19,40.674003,-74.224425,Got hit up on both the way in and out for "spare change" tonight! (@ 7-Eleven) http://4sq.com/b1aVuk
2010-07-03 02:37:39,40.667443,-74.235404,Blast! I just caved and bought Angry Birds for iPhone.
2010-07-03 21:50:46,40.661794,-74.246202,3rd of July barbecue. I find myself once again responsible for the grilling of the meat.
2010-07-04 11:30:56,40.661873,-74.210430,Shooting a time lapse in church today. Just because.  http://twitpic.com/22eidi
2010-07-04 17:44:03,40.651038,-74.221770,@mclanea It was a pretty epic moment! We tell her that she waves in the Holy Spirit, kinda like the grounds crew at an airport.
2010-07-04 17:57:37,40.667328,-74.235300,Eating grilled chicken in honor of John Adams. A burger for George Washington! (@ Casa de Hartz w/  @flowerintherain @mjhartz)
2010-07-04 20:55:07,40.647419,-74.185996,Fireworks time! (@ Veteran's Memorial Waterfront Park) http://4sq.com/9obIc9
2010-07-05 02:52:06,40.651038,-74.221770,I gotta stop staying up so late...  Waking up in 4 hours.
2010-07-06 12:44:10,40.686088,-74.292751,People are complaining about the heat, but it's really not that bad when compared to, say, the surface of the sun. Actually quite enjoyable.
2010-07-06 13:21:01,40.686074,-74.292866,@BiancaRoonz Thats awesome! My car has no AC too!
2010-07-06 18:49:34,40.687289,-74.300031,Seriously? These guys are still around? http://twitpic.com/231hs8
2010-07-06 21:29:31,40.667357,-74.235460,@Elibry  http://twitpic.com/232llk
2010-07-06 21:30:22,40.667357,-74.235460,Is it just me or does Discovery Channel only air The Deadliest Catch now?
2010-07-07 15:12:38,40.652515,-74.223252,Welcome to Twitter, @GiveMeCOURAGE!
2010-07-09 02:05:19,40.652414,-74.223376,@davidjtate Well at least there's two of us.
2010-07-09 12:20:44,40.687122,-74.242042,OH:  @trippingjimmies: "I'm getting a tummy ache." @mjhartz: "That's cause you're drinking Calypso!"
2010-07-09 14:15:51,40.667181,-74.235263,@trippingjimmies just dropped a 1/2" wrench square onto the head of his son.   He said, "Oops."  #fatheroftheyear http://twitpic.com/23t0hc
2010-07-09 14:24:14,40.667170,-74.235241,@Elibry That actually looks kinda good. Michael asks if you put Adobo on it.
2010-07-09 14:26:18,40.651012,-74.221913,Playing games before the final Bridge of the season.   @bridgeyouth http://twitpic.com/23t3eo
2010-07-09 20:25:29,40.661967,-74.212601,Just taught two of my guys how to play Spades at The Bridge. This is youth ministry at its core.
2010-07-10 13:13:52,40.686061,-74.292916,@Ruahh I feel sorrow for that individual.
2010-07-10 14:47:49,40.667396,-74.235376,@sbchacon @flowerintherain I saw some of my 5th graders at the fireworks on July 4. Good times.
2010-07-11 07:43:31,40.663428,-74.233997,I'm at that point of tired where it physically hurts and makes you feel kinda sick, but we must push forward with today's activities!
2010-07-11 08:05:56,40.662182,-74.212384,Set-up and rehearsal with Unspoken before their show. (@ The Liberty Center) http://4sq.com/d40vVM
2010-07-11 11:10:13,40.663925,-74.211316,Sound check for Unspoken before their performance at the church's anniversary celebration.  http://twitvid.com/WVXQZ
2010-07-11 13:22:54,40.662006,-74.210669,This is about to happen.  http://twitpic.com/24fk1c
2010-07-11 14:13:50,40.661920,-74.210853,Stanley Cup finals begin in 15 minutes! Yeah!
2010-07-11 23:27:19,40.651009,-74.221948,I have struck gold, friends. I have struck gold.  http://twitpic.com/24kfz4
2010-07-12 07:50:41,40.663000,-74.176700,Start of #TheMission2010. (@ Country Inns And Suites By Carlson) http://4sq.com/dARv2t
2010-07-12 18:10:03,40.662843,-74.176855,My dude is all muscle.  http://twitpic.com/24rpyv
2010-07-13 07:12:56,40.684940,-74.192049,@sharonykim It's so bright! What does it mean???
2010-07-13 08:04:14,40.662834,-74.176931,13 hours of sleep out of the past 72 hours. I'm gonna need to nap today.   Here we go!
2010-07-13 10:20:23,40.672929,-74.247305,Picking up some poison ivy wash for a work crew who ran into the accursed weed. #TheMission2010 (@ CVS) http://4sq.com/7rPjHS
2010-07-13 10:29:44,40.671084,-74.253196,Why is the CVS parking lot completely full yet there is no one in the store? http://twitpic.com/24y292
2010-07-13 10:51:52,40.674705,-74.217877,I'm going to make her ring a bell and shout "unclean" for the rest of the day.   #TheMission2010 http://twitpic.com/24y8gl
2010-07-13 11:06:26,40.694403,-74.255841,Paint restocking run for Crew 5! #TheMission2010 (@ Lowes Home Center) http://4sq.com/9t7q2y
2010-07-13 19:02:36,40.667880,-74.259701,@sharonykim Too much!  TOO MUCH!
2010-07-13 19:08:40,40.668485,-74.260244,@angieawemazing killed 3 zebras with her bare hands (and teeth) to make this bag.  http://twitpic.com/251rgm
2010-07-14 00:53:32,40.684940,-74.192049,I miss @jinglescat.
2010-07-14 09:32:15,40.672180,-74.214591,I just became the mayor of 2nd Home Adult Medical Day Care on @foursquare! http://4sq.com/9I7vFt
2010-07-14 14:42:26,40.669681,-74.215663,For those who are interested, Crew 13 just had an actual @jsiniscal sighting on N Broad St.   #TheMission2010
2010-07-14 15:54:34,40.651752,-74.214998,Getting drinks for Crew 13 since they did so good today. #TheMission2010 (@ 7-Eleven) http://4sq.com/ceByuP
2010-07-14 17:27:01,40.684207,-74.192960,Crew 13 was "in tune" this afternoon.   #TheMission2010 http://twitpic.com/25b2if
2010-07-14 17:29:54,40.670933,-74.119251,Epic graffiti gets the Led out in Mattano Park.  http://twitpic.com/25b37i
2010-07-14 17:46:51,40.662919,-74.176347,For the record: AT&T is practically useless in this area.
2010-07-15 07:45:25,40.662861,-74.176930,Everyone is getting sooo excited when they see that bacon is for breakfast!
2010-07-15 11:47:24,40.671256,-74.218986,6-inch rule fail.  http://twitpic.com/25isdk
2010-07-15 16:38:39,40.672571,-74.230855,Driving this van around the city is costing me $20/day in gas. That hurts. (@ ENR*G SVC) http://4sq.com/9OK1sh
2010-07-15 23:56:40,40.637429,-74.248697,Armando made us stop at his house to get more underwear. (I think he soiled his current ones).
2010-07-16 00:03:40,40.640901,-74.241786,@JenieMarie @ejone9 For the record, I just bought that domain.
2010-07-16 00:11:06,40.662602,-74.206807,Update: Armando just soiled his new boxers. #fact
2010-07-16 00:33:32,40.663017,-74.176571,While I do not necessarily dislike Dr Pepper, I am not a super fan; I did, however, just buy two. The reason: there was a $1 off coupon.
2010-07-16 22:48:06,40.698309,-74.216736,We left Dorney Park and it was 86°. Why is it 100° in Elizabeth?!? At 11pm!!! http://twitpic.com/25z2pj
2010-07-19 09:01:04,40.686300,-74.293000,With @carloscedeno, making his chest get all kinds of jell-oy. (@ Retro Fitness) http://4sq.com/a6HPtq
2010-07-20 19:38:50,40.668123,-74.215547,Ah, the sweet smelling air of Elizabeth, NJ! Home! (@ NJT: Elizabeth Station) http://4sq.com/8WTcwm
2010-07-20 19:54:09,40.665364,-74.227631,@adrian These are the (old) trains on the line by my house. Slowly they are replacing them with new models, though.
2010-07-20 22:50:23,40.662289,-74.236208,@living3368 I like it so far!
2010-07-21 14:48:02,40.664003,-74.233918,FYI: The Retro Fitness in Kenilworth, NJ is having a special one-day sale... $64 to sign up and 2 months free. @GoRetroFitness
2010-07-21 16:26:33,40.663557,-74.239782,Es el major pan! http://twitpic.com/27dni2
2010-07-21 19:58:31,40.667410,-74.235451,Trip to supermarket.  Him: "Do you have a Shop Rite card?" Me: "Absolutely not!" Him: "...no?" Me: "No." Him: "Oh."  ::he looked depressed::
2010-07-22 12:51:12,40.667392,-74.235439,I love the History Channel.
2010-07-22 18:02:48,40.663670,-74.233865,Heading to Williams Field to see @lilninja96 play some soccer. Hopefully she doesn't break her face like she usually does when I'm there.
2010-07-22 18:58:51,40.650982,-74.211431,Soccer summer camp.  http://twitpic.com/27otkw
2010-07-22 20:13:16,40.651506,-74.212561,This is @elibry performing a B&E. http://twitpic.com/27pf95
2010-07-24 00:53:32,40.620356,-74.247932,@FlowerInTheRain Foul play! I had it for only 3 seconds!
2010-07-24 01:53:50,40.667328,-74.235300,Arriving home, I just saw a bunny rabbit nom nom nomming the grass in my front yard. (@ Casa de Hartz) http://4sq.com/aQhKUv
2010-07-24 21:20:27,40.667358,-74.235406,We totally just watched Space Jam.
2010-07-25 20:03:31,40.673670,-74.231745,@CaliLewis I use Simplenote and love it, especially how it automatically syncs notes to the web and my computers!
2010-07-25 21:25:43,40.673870,-74.229897,Used fruit.  http://campl.us/dzF
2010-07-26 01:49:50,40.662141,-74.212378,New portrait: Ada Flores http://flic.kr/p/8mNkSb
2010-07-26 09:07:01,40.686300,-74.293000,Van Halen's "Jump" just came on the gym radio. Today is gonna be a good day. (@ Retro Fitness) http://4sq.com/a6HPtq
2010-07-26 18:02:57,40.667418,-74.235475,Why is it so nice out right now?
2010-07-27 10:50:53,40.639677,-74.200341,Why is it so difficult to legally dispose of wood in the city of Elizabeth?!? (@ Waste Management) http://4sq.com/bc3i1W
2010-07-27 17:08:50,40.667411,-74.235444,@lilninja96 I was gonna come, but I can't afford the gas it would take to get there. :/ Maybe the next home game.
2010-07-28 09:58:53,40.686061,-74.292916,@carloscedeno is contractually getting back to basics! http://twitpic.com/29forc
2010-07-28 13:14:06,40.651443,-74.348213,The *behemoth* like qualities of this burrito have produced quite a filling experience. #wordoftheday http://twitpic.com/29h9cr
2010-07-28 17:45:57,40.658681,-74.287570,Torture/execution devices of the Dark Ages and Medieval times were pretty intense and barbaric. I don't think that was a fun time to live.
2010-07-28 19:40:27,40.667399,-74.235446,The designer of this label was totally inspired by the icons for Microsoft Office: Mac.  http://twitpic.com/29k4sc
2010-07-29 14:24:25,40.667374,-74.235456,@milagrosfarias Us too! http://twitpic.com/29s2wa
2010-07-29 15:01:50,40.667366,-74.235459,Rice Krispie Treats are about to happen.  http://twitpic.com/29sd4j
2010-07-29 20:02:54,40.667364,-74.235430,I totally rocked the face off of Plants vs. Zombies today. The Zomboss had no chance.   Such a good game.
2010-07-29 21:21:40,40.667394,-74.235414,@jrmeneses Do we know her?
2010-07-29 21:39:06,40.667442,-74.235491,@jrmeneses Well, that narrows it down. :/
2010-07-30 15:14:31,40.667328,-74.235300,Locked out. And @mjhartz refuses to answer his phone. (@ Casa de Hartz) http://4sq.com/aQhKUv
2010-07-30 17:17:30,40.667377,-74.235471,Day ball too bright! http://twitpic.com/2a4crw
2010-07-30 20:35:43,40.643691,-74.287844,Winfield Park Waterfall pano http://twitpic.com/2a5zb1
2010-07-30 22:49:52,40.667363,-74.235423,@FlowerInTheRain I never said I was going. :) I said we have everything they have here for free.
2010-07-31 09:37:19,40.667383,-74.235444,OH: "I'm gonna poop in your pants!"
2010-07-31 14:07:01,40.650602,-74.242227,Electrolytes are good.
2010-07-31 23:24:35,40.611012,-74.121176,Inception in IMAX.
2010-08-02 13:32:47,40.651907,-74.348604,@davidjtate That was a good game!
2010-08-02 14:05:36,40.651499,-74.348021,It's amazing how many of our conversation revolve around doodoo.
2010-08-02 14:25:10,40.651536,-74.348075,Are Snapple facts actually true?
2010-08-02 17:38:09,40.667435,-74.235499,Say what you want about lazy people, but mid-day naps were, by far, their greatest creation and contribution to society.
2010-08-02 18:45:38,40.659919,-74.232493,@joyfulmelody That's still cheating!!! ;)
2010-08-02 18:53:42,40.655254,-74.215924,Just in case you are wondering, I am by no means a professional electrician. In fact my garage might now blow up. http://twitpic.com/2b2vzp
2010-08-02 18:56:04,40.652480,-74.215719,@JessePntr but what if that one was the only untrue one?
2010-08-02 20:43:13,40.676957,-74.231158,Tennis with @elibry.  http://twitpic.com/2b3qra
2010-08-02 22:43:28,40.667374,-74.235456,Global domination! http://twitpic.com/2b4o8e
2010-08-03 11:15:40,40.677123,-74.233696,Tennis Tuesday! (@ Kean University Tennis Courts) http://4sq.com/9PdLln
2010-08-03 12:51:01,40.677704,-74.234234,For the record, me and @flowerintherain just beat @castro0 and @juslisten923 pretty bad.   #tennistuesday
2010-08-03 13:07:46,40.677769,-74.234470,Now, @flowerintherain and I shut out @castro0 and @mjhartz. They're mad.
2010-08-04 09:52:09,40.686061,-74.292916,This is @JordanelOrphan trying to make his chest not little like a 10-year-old girl anymore.  http://twitpic.com/2bjal0
2010-08-04 13:19:27,40.667377,-74.235471,@lilninja96 Oh yes
2010-08-04 17:55:28,40.662097,-74.231659,The Big FourSquare Home Invasion tour is underway! #4sqTour
2010-08-04 18:05:51,40.662097,-74.231659,OH: "He's not the sharpest tool in the shed, but he certainly is a tool."
2010-08-04 20:14:56,40.664685,-74.231765,Buying salsa. And an avocado. (@ Pathmark w/  @mjhartz) http://4sq.com/bKS6cU
2010-08-05 13:08:55,40.661983,-74.211102,Bridge: Midtown Lunchtime Meetup (@ Coffee House) http://4sq.com/cPw4en
2010-08-07 02:17:45,40.661880,-74.212150,Late night at the 24-Hour Bible Read-a-Thon fundraiser for the 2011 Bridge youth retreat.  http://twitpic.com/2ccngb
2010-08-07 03:48:46,40.661880,-74.212150,Feel the power.  http://twitpic.com/2cddd3
2010-08-07 05:21:30,40.667328,-74.235300,The sun is coming up. I'm going to sleep. There's something fundamentally wrong with this. (@ Casa de Hartz) http://4sq.com/aQhKUv
2010-08-07 20:59:34,40.667364,-74.235430,Making pudding! http://twitvid.com/VTJVI
2010-08-07 21:21:40,40.667363,-74.235423,This tragedy happened due to negligence while the aforementioned pudding was being made. #hotdogfail http://twitpic.com/2cmuwg
2010-08-08 01:36:56,40.667364,-74.235430,Kind of a lot tired. See you tomorrow, Twitter.
2010-08-08 13:51:14,40.661928,-74.211301,This is why you don't screw with nature.  Shark Week on the TV at Coffee House during lunch.
2010-08-08 15:57:39,40.667364,-74.235430,Saw a mariachi band walking down Dickinson St, instruments in hand.
2010-08-08 18:59:05,40.659352,-74.205529,A heart at peace gives life to the body, but envy rots the bones.
2010-08-08 22:52:53,40.649847,-74.240067,GPS fail.  http://twitpic.com/2czuf2
2010-08-09 12:36:37,40.667435,-74.235526,@cheesteak No, no.. #wordsthatledtoawesomeness
2010-08-09 13:27:01,40.667383,-74.235444,@castro0 @cheesteak I may have to post those videos now.
2010-08-09 17:26:24,40.686300,-74.293000,I forgot about Monday Madness on Monday evenings. (@ Retro Fitness w/  @mjhartz) http://4sq.com/a6HPtq
2010-08-09 20:38:31,40.696201,-74.270121,Meeting. (@ Van Gogh's Ear Cafe w/  @flowerintherain @mjhartz) http://4sq.com/9DBeMO
2010-08-10 18:14:31,40.677518,-74.234151,Tennis Tuesday is underway! http://twitpic.com/2dice7
2010-08-10 18:15:39,40.677518,-74.234151,@FlowerInTheRain See, even girls talk about it.
2010-08-10 18:50:29,40.677454,-74.234007,Michael "San Andreas" Hartz   @mjhartz #tennistuesday
2010-08-10 19:02:03,40.677501,-74.234010,@FlowerInTheRain But you thought it witty enough to mention publicly. Thus, I win!  :D
2010-08-11 12:27:39,40.665313,-74.233923,I've never so many police cars out patrolling across all towns at a single time. They're pulling everyone over.
2010-08-11 12:28:16,40.667164,-74.235085,@lilninja96 Getting diesel?
2010-08-11 12:32:22,40.666592,-74.234007,The power just went out in my house. I think it's the entire area. Anyone else experiencing it?
2010-08-11 18:44:04,40.667392,-74.235439,Photoshoot is over and went well!
2010-08-12 10:09:20,40.658431,-74.231128,We're on the way for some Tennis Thursday awesomeness!
2010-08-12 11:47:08,40.677350,-74.233971,Game, Set, and Match. @flowerintherain and I destroyed @mjhartz and @lilninja96.   #tennisthursday
2010-08-12 12:55:54,40.675018,-74.300905,Sleepy sleepy.  http://twitpic.com/2e1gqe
2010-08-12 13:24:05,40.688579,-74.309858,Getting my glasses adjusted and visiting my old friend, Bill Kenny. (@ Lens Crafters) http://4sq.com/9r7TCo
2010-08-12 13:35:22,40.687472,-74.300237,I always think it's funny to see people sitting next to the Ronald McDonald statue, like they're boys. (@ Walmart) http://4sq.com/bRFVvx
2010-08-12 17:09:05,40.676082,-74.208364,I absolutely love these new double decker NJ Transit trains.
2010-08-12 17:26:19,40.744567,-74.121683,Abandoned.  Rail lines to the old Elizabeth station.  http://twitpic.com/2e3hq2
2010-08-12 21:18:55,40.661904,-74.212016,@mjhartz's summation of the band rehearsal debate in terms of 80s hair bands.  "I want to play like Petra. They want to play like Stryper."
2010-08-12 21:42:54,40.661904,-74.212016,It's situations like this that make you ask serious questions about what kind of person you want to be. http://twitpic.com/2e5lt1
2010-08-12 22:55:01,40.667417,-74.235506,About to go to Zombieland.
2010-08-13 19:00:43,40.677103,-74.267025,About to do photos for a birthday party for a person I've never met.  http://twitpic.com/2efvsj
2010-08-13 19:02:05,40.677103,-74.267025,@sharonykim congratulations!
2010-08-13 19:02:54,40.677094,-74.267020,@JenieMarie I'm sorry.
2010-08-13 20:30:26,40.677103,-74.267025,Just had a piece of ham that wasn't pink. It really is the other white meat!!!
2010-08-13 21:33:29,40.677103,-74.267025,Well, ok... I suppose it isn't really a party until some starts a conga line.
2010-08-14 14:41:23,40.655828,-74.247844,Photo gig #2 for the weekend. There's gonna be so much post work to do after this. (@ Warinanco Park - Roselle) http://4sq.com/cFwkoZ
2010-08-14 19:41:24,40.663188,-74.253612,Party is over. My back hurts a lot, but it was fun.
2010-08-16 07:45:14,40.667417,-74.215779,Here we go again.  http://twitpic.com/2famuu
2010-08-16 11:55:29,40.690900,-74.250400,Post-workout chicken wraps are so much better than regular chicken wraps. (@ Quick Chek) http://4sq.com/aVX3oH
2010-08-16 12:37:50,40.667117,-74.234840,It's amazing how much you can get done before noon if you wake at 6:30. Of course, the waking at 6:30 part sucks some of the fun from it.
2010-08-16 19:49:09,40.663191,-74.213996,Seeing stuff likes this makes me realize how much I really do love my Kindle.   Technology FTW.  http://twitpic.com/2ffw3h
2010-08-16 20:19:15,40.663191,-74.213996,@ColorfulJoy It's so much better than paper.
2010-08-16 20:34:16,40.663191,-74.213996,@ColorfulJoy Save the trees! Embrace eBooks!
2010-08-16 20:36:02,40.662363,-74.212119,My night consists of repairing damaged theater lights. Isn't it glamorous? http://twitpic.com/2fg908
2010-08-16 20:47:01,40.663191,-74.213996,This lil guy had a bad day.  http://twitpic.com/2fgc0q
2010-08-16 22:19:26,40.667197,-74.215907,Drunk dude just raced to my car like he was on a mission. Also like he was Frankenstein.
2010-08-17 11:11:58,40.677538,-74.234135,OH from @lilninja96: "I like tennis more than soccer!"
2010-08-17 11:17:31,40.677400,-74.234056,No ice cream on the tennis court.  http://twitvid.com/EZDQJ
2010-08-17 11:24:04,40.677344,-74.234066,I'm just saying... @jrmeneses is drinking a protein shake while playing tennis is 90° weather.
2010-08-17 14:57:24,40.651943,-74.199390,Whatever the "it" is in Gatorade, I now have 96oz of it in me.
2010-08-17 19:42:48,40.548209,-74.333550,Matt S. is a super helpful and awesome Apple Genius. New iPhone 3GS to replace my damaged one! (@ Apple Store w/ 4 others)
2010-08-21 15:06:06,40.675203,-74.217485,Running the BBQ for a School 7 staff lunch shindig. (@ Cedeño Home) http://4sq.com/c8C8zR
2010-08-23 07:43:11,40.668123,-74.215547,Pick up camera lens-return camera lens. It has become my weekly ritual. (@ NJT: Elizabeth Station) http://4sq.com/8WTcwm
2010-08-23 16:10:37,40.710945,-74.310277,Black with chrome accents. Quite a manly place. (@ Muscle Maker Grill w/ @mjhartz) http://4sq.com/dv1fMb
2010-08-26 17:26:05,40.750264,-73.992813,Taxi driver seemed like I was inconveniencing him by asking him to take me to Penn Station. (@ New York Penn Station w/ 33 others)
2010-08-26 18:35:38,40.665457,-74.235568,Bridge 10-year anniversary. (@ Aroma lounge w/ @mjhartz @kelsey_leigh) http://4sq.com/aOG0i8
2010-08-27 19:54:17,40.658801,-74.106378,Filming a video for The Bridge. Let's hope it came out like we wanted it to. (@ richard rutkowski park) http://4sq.com/d6cPvB
2010-08-28 15:38:15,40.758255,-74.172276,Working video for a 60th birthday party. Here we go. (@ Emmanuel Church of Christ) http://4sq.com/bcOqc3
2010-08-31 09:20:23,40.662182,-74.212384,Running sound and projection for a military funeral today. (@ The Liberty Center) http://4sq.com/d40vVM
2010-08-31 19:30:15,40.655828,-74.247844,At a School 7 BBQ for the new 8th graders. (@ Warinanco Park - Roselle) http://4sq.com/cFwkoZ
2010-09-01 08:39:08,40.686300,-74.293000,OH gym encouragement: "Just focus on something, get Hulk Angry, and do it!" (@ Retro Fitness) http://4sq.com/a6HPtq
2010-09-18 10:40:53,40.662182,-74.212384,Equip Conference... All day. Teaching a seminar about how to mix sound for live performances. (@ The Liberty Center) http://4sq.com/d40vVM
2010-09-20 13:20:27,40.652155,-74.199257,I'm at Terence C. Reilly School No. 7 (436 1st Ave, Loomis St, Elizabeth). http://4sq.com/bzV2i7
2010-09-22 06:53:02,40.661689,-74.233310,Breakfast of champions?  http://twitpic.com/2qu7xx
2010-09-22 19:49:07,40.665727,-74.234487,@chacoella It is the most epic of newspapers!
2010-09-22 20:39:30,40.667369,-74.235511,Got in the car to go to the gym. Noticed I may not even have gas to get to work tomorrow. Now inside eating Rice Krispies. Bring poor stinks
2010-09-23 08:06:17,40.652155,-74.199257,Picture day with 1000 students. Let the madness begin. (@ Terence C. Reilly School No. 7) http://4sq.com/bzV2i7
2010-09-23 08:37:51,40.652643,-74.198843,Hand in the pocket. Sweatervest. The most stylish 3rd Grader in the school.
2010-09-23 21:11:58,40.673855,-74.229992,I was blessed by someone's generosity today.   The beauty of the Church when it is actually being the Church is staggering.
2010-09-23 21:42:20,40.674114,-74.229749,Fish.  http://twitpic.com/2rc2tx
2010-09-24 08:58:51,40.652386,-74.199161,@mjhartz Don't know yet.
2010-09-24 11:06:01,40.652471,-74.199231,The Teacher's cafeteria had a pretty good peach cobbler today for lunch. That being said, hot fruit still kinda freaks me out a bit.
2010-09-24 14:13:06,40.676800,-74.211500,Totally just saw a "sick" student at the store while picking up photos for Back to School Night. (@ Walgreens) http://4sq.com/boGbvr
2010-09-24 22:29:12,40.674332,-74.229554,We got new assigned new groups in @bridgeyouth today. @infinite729 and I are handling high school boys henceforth. Gonna be fun!
2010-09-26 00:26:57,40.673736,-74.230042,From tonight's dinner conversation:  "Well, if something eats *and* doodoos, then it clearly must have a digestive system."
2010-09-26 21:10:15,40.620440,-74.243749,OH:  "Life would be terrible without elbows."
2010-09-27 09:18:03,40.652065,-74.199553,Had too many 25¢ wings at Applebees last night.   :/
2010-09-27 09:45:17,40.652065,-74.199553,The teacher computer took 10 minutes to book and log in.   A new record!
2010-09-28 21:11:01,40.693683,-74.287117,Just saw a dude deadlift 405-lbs. I'm fairly impressed.
2010-09-29 13:30:33,40.652568,-74.199536,Tonight is Back to School night. Soooooo much to do and no time to do it. :/
